movie_title,reviewer,rate,review
헝거,헤니,1.5,맛있으면 그만
헝거,하얀얼룩말,3.0,그땐 선배들의 어깨 뒤로 내 세상인가 했더니 어느새 내 등 뒤의 후배들이 날 바라보고 있구나.
헝거,까칠한 평론가,3.0,태국 영화의 놀라움과 실망감을 동시에…
헝거,아재소방,3.0,태국도 은근히 빈부차이가 심하네...
헝거,윤예지,2.0,좋을뻔.. 했다
헝거,박지상,5.0,"허기짐은 두 가지로 나누어진다, 진짜 허기와 거짓 허기.과연 우리에게 필요한 허기짐은 무엇일까?"
헝거,JW,3.0,"태국 영화에 기대를 안한건 역시 나의 편견이었다. 약간 일본 감성도 느껴지지만, 느낌 좋은데?"
헝거,시늉,2.0,뭔가 전하려 했지만 한마디로 재미가 없다남는건 태국 배우들도 꽤 매력이 있구나 하는 정도
헝거,쫄병,1.5,캐릭터들 정말 매력적인데 스토리가 다 개박살냈음
헝거,Seow,4.0,"""넌 성공하지 못 할거야.""""넌 배가 덜 고팠거든""길거리 음식 요리사에서 세계적인 명성의 쉐프가 되기까지. 음식이 상당히 매력적이고 상당한 맛의 가치를 추구하고 기고한 철학을 추구한다는 것이 매우 놀라웠으며 몰입되고 재밌게 볼 만한 영화였다.스포일러가 있어요!! 보기"
헝거,채은,2.0,영화 제목을 너무 비장하게 잘 지음...
헝거,Scruge,2.0,"사람에게는 저마다 맞는 옷이 있다. 그게 꼭 비싸거나 싸다는 것에 의해 정해지는 것이 아닌, 자신의 인생이 그 석에 담겨 있다고 생각한다..꼭 사람이 틀 속에 갇혀 살아야 하는 것은 아니지만, 그 틀을 벗어 던졌을 때 자신과 일평생을 함께한 무언가가 함께 사라질 수 있다는 것, 그게 설령 자신에게 있어 가장 소중하고 가치 있는 것이라 한들 가차 없이 사라질 수 있다는 점을 알아야 한다..오랜만에 봐서 좋았던 태국 작품. 흐름이 조금씩 끊기는 듯한 느낌, 진부함과 특유의 오글거림도 존재했지만, 나름 괜찮았던 것 같다."
헝거,임승권,1.5,리뷰가 다 비슷하네 ㅋㅋㅋ위플래쉬 따라하다 길을 잃은 감독내 생각엔 위플래쉬 따라해야지 욤뇸뇸 하다가아시안 정서에 맞춰야지 하다가 망한 영화
헝거,박명수,3.0,겉으로는 뜨거워 보이지만 다르게는 따뜻할 수 있는 것.
헝거,ming,3.0,2023.04.13 넷플릭스 관람
헝거,굽영,3.0,태국가고싶다
헝거,shinms,5.0,"보는 내내 '요리사,도둑,그의아내 그리고 그의정부' 영화가 계속 생각났다 태국영화가 생소한데 스타일리쉬 해서 좋았다 음악도 좋았고 감독의 다른 작품도 찾아보고 싶어졌다 기교가 좋다"
헝거,김태완,2.5,배드지니어스를 기대하고 봤으나 위플래시 짝퉁... 인생을 말하기엔 너무 짧고 성장을 말하기엔 너무 길다
헝거,쭈니,4.0,순수한 갈증은추악한 욕망의 불로 볶아행복을 찾아가는 내가 된다.순수함은 잃지 않은채
헝거,강혜림,2.0,"빈약한 스토리, 촌스러운 연출, 종잡을 수 없는 캐릭터 설정..씨즐컷 촬영만은 기깔남."
헝거,ViNTeR,0.5,이래서~~ 내 주방에 직원 안쓰는거야
헝거,Danny S Kim,2.5,태국버젼 박소담의 위플래쉬 + 더 메뉴 😅
헝거,조민지,4.0,권상우를 후원하는 빈지노 ㅋㅋㅋ 농담이고 여주 얼굴 내 취향. 영상미가 이국적이고 좋았다. 요리판 악마는 프라다를 입는다 같음.
헝거,Maya Kim,3.0,킬링타임으로 오케이결말이나 클리셰가 많지만 태국 로컬 식당이 그리워지는 영화
헝거,십일,2.5,한놈은 뭔 마약을 쳐놓고 한놈은 징징이를 쳐놓고 비룡이냐
헝거,박정은,1.0,긴장감있는 음악에 따라가지 못하는 매우 허술한 전개와 배우들의 연기+ 스포셰프를 광인으로 표현하려는데 실패한 이유셰프가 화낼때 화날만 해서(셰프만 정상임. 물건 집어던지고 모욕하는건 잘못이지만..)1. 식재료 도난한 직원당연히 잘못한 것 아닌가?2. 주방에서 담배피는 직원위생에 털난거 아닌가3. 알레르기 있는 손님음식에 새우 넣은 직원미친거 아닌가
헝거,한글별명,1.5,불을 다룰줄 안다면서..  왜 센불로만해?
헝거,김승환,3.0,무난무난한 부분들은 좀 아쉬움230410
헝거,계곡,3.5,거북목 신경쓰여
헝거,유상원,2.0,미묘하게 지루하다
헝거,집착광숭,1.5,더 메뉴 + 위플래쉬인 줄 알고 봤는데 그냥 볶음밥이었다 볶볶…
헝거,앎이,1.5,배경음악이 집중을 망친다별거 아닌데 미스테리가 있을것만 같은 안맞는음악
헝거,잔인한詩,1.5,왕후의 밥과 걸인의 찬시장기만 속이면 된다이해치 못할 소재이다***유명 헝거 주방장 폴의 똘마니 톤이 동네 작은 국수가게 가업을 이어받을 꿈도 없는 주방장인 (아)오이한테명함을 주며 큰물에서 놀라고 한다친구들에게 명함을 보여줬더니 우와 하고검색해보니 대단한 사람이라 찾아간다요리학교 출신과 볶음밥 대결에서 이긴 아오이는 채용되는데코뿔새 사냥 조리관둠사업가 톳의 초대식당 열기밀키 부인 파티 요리 대결폴의 영상 유출 체포환멸을 느끼고 오이는 다시 원래 자리로 돌아간다***핍진성이 너무 떨어진다
"므이: 저주, 돌아오다",브리즈,2.0,돌아오지 말걸 그랬나??;;선 넘지 말아라엔딩곡 총 맞은것 처럼 표절??
"므이: 저주, 돌아오다",마늘빵,1.0,22년 작품이라니. 참아가며 봐야 하는데 내가 왜 인내하며 보는지 되묻다 종료했다. 기다려도 지루함뿐. 무섭지도 않고 스릴도 없고.
"므이: 저주, 돌아오다",노진경,0.5,무섭지도 않고재미있지도 않고슬프지도 않고감동적이지도 않고.
"므이: 저주, 돌아오다",evillady,1.5,이렇게 돌아올 바에야…
"므이: 저주, 돌아오다",전동민,2.5,"공포영화인데 뻔한 공포,전체적으로 납득이 안가는 스토리와 개연성이 없는 스토리 그리고 연기력이 너무나도 어색한 배우들의 연기를 보고있자니 하품만 나온다."
"므이: 저주, 돌아오다",조무영,0.5,어릴때 봤던 전설의고향은 무섭기라도 했지.
"므이: 저주, 돌아오다",도련님,1.0,안돌아와도 될듯... 공포영화 아님
"므이: 저주, 돌아오다",배소이,1.0,"므 이딴게 다있노,,"
"므이: 저주, 돌아오다",이수인,2.0,빙의배틀물
"므이: 저주, 돌아오다",잔인한詩,2.0,"Muoi: The Curse Returns화랑에서 일하는 린은 수영장 익사한 썸타던 카페 사장 오빠 키에트 장례식장에서고딩 동창이자 그때부터 대학 때까지같이 살던 절친이지만 2년간 연락을 못한 항을 만나는데항 曰 사는 집 전에 살던 집주인이르짜인, 곧 프랑스 식민 시대 전설적 화가였고항은 르짜인의 그림을 모사하고 있댄다항은 버스 정류장에서 사는 집 초대를 하는데린은 엄마와 선약이 있다하고 담을 기약하지만몸을 가누지 못하는 항이 걱정되어그집을 찾게 된다현재의 집주인은 르짜인 친척이라는 디외 부인화랑에 걸어놓은 항의 그림이 맘에 들어그집에 살도록 했다 한다린은 헛것과 귀신이 보이고담날 기침과 열이 나는 항을 위해 약국에 갔더니약사는 므이를 깨우지 말고 당장 그집을 나오랜다르짜인의 친구 무명화가 응우옌아내 홍내연녀 므이 자살저주 항이에게항과 린을 동시에 사귀었던 키에트이로 인해 갈라진 우정므이의 저주가 아닌질투심에 남편을 죽인 홍의 저주였고디외 부인은 르짜인 쌍둥이 큰딸였고항과 린의 몸에 홍의 영혼을 실으려고 했던 것디외는 항을 죽이도록 린을 부추겼으나린은 환상을 보고 모든 비밀을 알게 되는데디외는 린을 죽이려 하다가 거울을 보고 늙은 자신의 본모습과 어린 쌍둥이 동생을 보고선 계단을 구른다"
